{
  "schema_version": "goal-teams-rule-manifest-v2.50",
  "generation_id": "V2.66",
  "manifest_state": "derived_projection",
  "semantic_source": "owner_markdown_only",
  "source_digest_algorithm": "sha256_raw_file_bytes",
  "owners": [
    {
      "owner_id": "CORE-V250",
      "owner_kind": "core",
      "path": "references/current/generations/V2.66/core.md",
      "source_sha256": "c82ee191ce5e9b7e99ca53abf85240def6a3dfc80dfd3884af46b2ba465eddd0",
      "dependencies": [
        {
          "kind": "required",
          "owner_id": "ROUTING-V250"
        },
        {
          "kind": "required",
          "owner_id": "ASSURANCE-V250"
        },
        {
          "kind": "required",
          "owner_id": "CONTRACT-TASK-STATE-V250"
        },
        {
          "kind": "required",
          "owner_id": "CONTRACT-HARNESS-EVIDENCE-V250"
        },
        {
          "kind": "required",
          "owner_id": "CONTRACT-REVIEW-COMPLETION-V250"
        },
        {
          "kind": "required",
          "owner_id": "CONTRACT-APPROVAL-SIDE-EFFECTS-V250"
        }
      ],
      "route_membership": [
        "V250-ROUTE-STARTUP",
        "V250-ROUTE-DISCUSSION",
        "V250-ROUTE-SMALL-DEVELOPMENT",
        "V250-ROUTE-MEDIUM-DEVELOPMENT",
        "V250-ROUTE-LARGE-DEVELOPMENT",
        "V250-ROUTE-UI-DESKTOP",
        "V250-ROUTE-AGENT-RUNTIME",
        "V250-ROUTE-MEDIUM-RELEASE",
        "V250-ROUTE-LARGE-RELEASE"
      ],
      "owned_rule_ids": [
        "GT250-CORE-SCOPE",
        "GT250-CORE-AUTHORITY",
        "GT250-CORE-TRUTH",
        "GT250-CORE-SSOT",
        "GT250-CORE-EVIDENCE",
        "GT250-CORE-INDEPENDENCE",
        "GT250-CORE-SAFETY",
        "GT250-CORE-LOOP",
        "GT250-CORE-FIRST-LOOP",
        "GT263-CORE-PREDICTABLE-TIME",
        "GT263-CORE-PREDICTABLE-QUALITY"
      ]
    },
    {
      "owner_id": "ROUTING-V250",
      "owner_kind": "routing",
      "path": "references/current/generations/V2.66/routing.md",
      "source_sha256": "561cab55dc087aaa291fb7b481fd846b7c7d2e28a7bff1bb6ad2f0e581bdc929",
      "dependencies": [
        {
          "kind": "required",
          "owner_id": "CORE-V250"
        },
        {
          "kind": "required",
          "owner_id": "ASSURANCE-V250"
        },
        {
          "kind": "required",
          "owner_id": "CONTRACT-TASK-STATE-V250"
        },
        {
          "kind": "required",
          "owner_id": "CONTRACT-APPROVAL-SIDE-EFFECTS-V250"
        }
      ],
      "route_membership": [
        "V250-ROUTE-STARTUP",
        "V250-ROUTE-DISCUSSION",
        "V250-ROUTE-SMALL-DEVELOPMENT",
        "V250-ROUTE-MEDIUM-DEVELOPMENT",
        "V250-ROUTE-LARGE-DEVELOPMENT",
        "V250-ROUTE-UI-DESKTOP",
        "V250-ROUTE-AGENT-RUNTIME",
        "V250-ROUTE-MEDIUM-RELEASE",
        "V250-ROUTE-LARGE-RELEASE"
      ],
      "owned_rule_ids": [
        "GT250-ROUTE-TRUSTED-FACTS",
        "GT250-ROUTE-SIZE",
        "GT250-ROUTE-ASSURANCE",
        "GT250-ROUTE-PHASE",
        "GT250-ROUTE-ENVIRONMENT",
        "GT250-ROUTE-REPLAY",
        "GT250-ROUTE-EXPLAIN"
      ]
    },
    {
      "owner_id": "ASSURANCE-V250",
      "owner_kind": "assurance",
      "path": "references/current/generations/V2.66/assurance-levels.md",
      "source_sha256": "8228050844f912b1b46edc5a82a0cc985e8920595dc5b094baf8d3ea6f82165c",
      "dependencies": [
        {
          "kind": "required",
          "owner_id": "CORE-V250"
        },
        {
          "kind": "required",
          "owner_id": "ROUTING-V250"
        },
        {
          "kind": "required",
          "owner_id": "CONTRACT-HARNESS-EVIDENCE-V250"
        },
        {
          "kind": "required",
          "owner_id": "CONTRACT-REVIEW-COMPLETION-V250"
        }
      ],
      "route_membership": [
        "V250-ROUTE-STARTUP",
        "V250-ROUTE-DISCUSSION",
        "V250-ROUTE-SMALL-DEVELOPMENT",
        "V250-ROUTE-MEDIUM-DEVELOPMENT",
        "V250-ROUTE-LARGE-DEVELOPMENT",
        "V250-ROUTE-UI-DESKTOP",
        "V250-ROUTE-AGENT-RUNTIME",
        "V250-ROUTE-MEDIUM-RELEASE",
        "V250-ROUTE-LARGE-RELEASE"
      ],
      "owned_rule_ids": [
        "GT250-ASSURE-DISCUSSION",
        "GT250-ASSURE-LITE",
        "GT250-ASSURE-STANDARD",
        "GT250-ASSURE-FULL",
        "GT250-ASSURE-REGULATED",
        "GT250-ASSURE-NONESCALATION"
      ]
    },
    {
      "owner_id": "FUNCTION-REQUIREMENTS-V250",
      "owner_kind": "function",
      "path": "references/current/generations/V2.66/functions/requirements.md",
      "source_sha256": "26ff12046c6c30d307699d3e04046524303f0f3e8928974f2cb3736feb32c05c",
      "dependencies": [
        {
          "kind": "required",
          "owner_id": "CORE-V250"
        },
        {
          "kind": "required",
          "owner_id": "ROUTING-V250"
        },
        {
          "kind": "required",
          "owner_id": "CONTRACT-TASK-STATE-V250"
        },
        {
          "kind": "required",
          "owner_id": "CONTRACT-TEST-CASE-GATE-V250"
        }
      ],
      "route_membership": [
        "V250-ROUTE-DISCUSSION",
        "V250-ROUTE-SMALL-DEVELOPMENT",
        "V250-ROUTE-MEDIUM-DEVELOPMENT",
        "V250-ROUTE-LARGE-DEVELOPMENT",
        "V250-ROUTE-UI-DESKTOP",
        "V250-ROUTE-AGENT-RUNTIME",
        "V250-ROUTE-MEDIUM-RELEASE",
        "V250-ROUTE-LARGE-RELEASE"
      ],
      "owned_rule_ids": [
        "GT250-REQ-TRACEABILITY",
        "GT250-REQ-AC",
        "GT250-REQ-SCOPE",
        "GT250-REQ-CHANGE",
        "GT250-REQ-DENOMINATOR-SEED",
        "GT263-REQ-CONSUMER-GATE",
        "GT263-REQ-FINDING-ADMISSION"
      ]
    },
    {
      "owner_id": "FUNCTION-ARCHITECTURE-IMPLEMENTATION-V250",
      "owner_kind": "function",
      "path": "references/current/generations/V2.66/functions/architecture-implementation.md",
      "source_sha256": "5347121249e663ffd1a687685abf117ed229935a7a07d212caee0c8cc8143835",
      "dependencies": [
        {
          "kind": "required",
          "owner_id": "FUNCTION-REQUIREMENTS-V250"
        },
        {
          "kind": "required",
          "owner_id": "FUNCTION-TESTING-V250"
        },
        {
          "kind": "required",
          "owner_id": "CONTRACT-TEST-CASE-GATE-V250"
        },
        {
          "kind": "required",
          "owner_id": "CONTRACT-HARNESS-EVIDENCE-V250"
        },
        {
          "kind": "required",
          "owner_id": "CONTRACT-TASK-STATE-V250"
        }
      ],
      "route_membership": [
        "V250-ROUTE-SMALL-DEVELOPMENT",
        "V250-ROUTE-MEDIUM-DEVELOPMENT",
        "V250-ROUTE-LARGE-DEVELOPMENT",
        "V250-ROUTE-UI-DESKTOP",
        "V250-ROUTE-AGENT-RUNTIME",
        "V250-ROUTE-MEDIUM-RELEASE",
        "V250-ROUTE-LARGE-RELEASE"
      ],
      "owned_rule_ids": [
        "GT250-ARCH-TRIGGER",
        "GT250-ARCH-ENVIRONMENT",
        "GT250-IMPL-TDD",
        "GT250-IMPL-INCREMENTAL",
        "GT250-IMPL-IDENTITY",
        "GT263-IMPL-EXACT-SET",
        "GT263-IMPL-BUDGET-EXIT"
      ]
    },
    {
      "owner_id": "FUNCTION-TESTING-V250",
      "owner_kind": "function",
      "path": "references/current/generations/V2.66/functions/testing.md",
      "source_sha256": "20e5dd2b1f63a7280dc8c55dbe7febf85296204640d522c0174ebd31f0757a22",
      "dependencies": [
        {
          "kind": "required",
          "owner_id": "FUNCTION-REQUIREMENTS-V250"
        },
        {
          "kind": "required",
          "owner_id": "CORE-V250"
        },
        {
          "kind": "required",
          "owner_id": "CONTRACT-TEST-CASE-GATE-V250"
        },
        {
          "kind": "required",
          "owner_id": "CONTRACT-HARNESS-EVIDENCE-V250"
        },
        {
          "kind": "required",
          "owner_id": "CONTRACT-REVIEW-COMPLETION-V250"
        }
      ],
      "route_membership": [
        "V250-ROUTE-SMALL-DEVELOPMENT",
        "V250-ROUTE-MEDIUM-DEVELOPMENT",
        "V250-ROUTE-LARGE-DEVELOPMENT",
        "V250-ROUTE-UI-DESKTOP",
        "V250-ROUTE-AGENT-RUNTIME",
        "V250-ROUTE-MEDIUM-RELEASE",
        "V250-ROUTE-LARGE-RELEASE"
      ],
      "owned_rule_ids": [
        "GT250-TEST-DENOMINATOR",
        "GT250-TEST-PHASES",
        "GT250-TEST-DEVELOPMENT",
        "GT250-TEST-RELEASE",
        "GT250-TEST-ORACLE",
        "GT250-TEST-DEFECT",
        "GT250-TEST-COVERAGE",
        "GT263-TEST-FIXED-REGRESSION",
        "GT263-TEST-BLOCKED-TRUTH"
      ]
    },
    {
      "owner_id": "FUNCTION-UI-DESKTOP-V250",
      "owner_kind": "function",
      "path": "references/current/generations/V2.66/functions/ui-desktop.md",
      "source_sha256": "6ed297469b6ab90377780ec8eda56c01ea3f2e937d6c46a75b4b941f02ce4184",
      "dependencies": [
        {
          "kind": "required",
          "owner_id": "FUNCTION-REQUIREMENTS-V250"
        },
        {
          "kind": "required",
          "owner_id": "FUNCTION-TESTING-V250"
        },
        {
          "kind": "required",
          "owner_id": "FUNCTION-AGENT-RUNTIME-V250"
        },
        {
          "kind": "required",
          "owner_id": "CONTRACT-TEST-CASE-GATE-V250"
        },
        {
          "kind": "required",
          "owner_id": "CONTRACT-HARNESS-EVIDENCE-V250"
        }
      ],
      "route_membership": [
        "V250-ROUTE-UI-DESKTOP"
      ],
      "owned_rule_ids": [
        "GT250-UI-TRIGGER",
        "GT250-UI-STATE-MATRIX",
        "GT250-UI-E2E",
        "GT250-UI-PIXEL",
        "GT250-DESKTOP-CAPABILITY"
      ]
    },
    {
      "owner_id": "FUNCTION-AGENT-RUNTIME-V250",
      "owner_kind": "function",
      "path": "references/current/generations/V2.66/functions/agent-runtime.md",
      "source_sha256": "718aba457b1deb18fb51470deccc73508ee41efbeede4725bc2548294f53508a",
      "dependencies": [
        {
          "kind": "required",
          "owner_id": "CORE-V250"
        },
        {
          "kind": "required",
          "owner_id": "ROUTING-V250"
        },
        {
          "kind": "required",